title,url,thumbnail_url,channel,description
"Billie Eilish: Same Interview, The Fifth Year | Vanity Fair",https://www.youtube.com/watch?v=_wNsZEqpKUA,https://i.ytimg.com/vi/_wNsZEqpKUA/hqdefault.jpg?sqp=-oaymwEcCPYBEIoBSFXyq4qpAw4IARUAAIhCGAFwAcABBg==&rs=AOn4CLDg1rSssxGPzAGOPsWe4ZOijff2tA,Vanity Fair,"""I'm so much more open to stuff now."" On the verge of 100 million followers, Billie Eilish is ready to step back into the world as the most comfortable version of herself. Filled with new life..."
Redneck vs Fancy Whiskey Glass,https://www.youtube.com/watch?v=2jfbXZiE6Lc,https://i.ytimg.com/vi/2jfbXZiE6Lc/hqdefault.jpg?sqp=-oaymwEcCPYBEIoBSFXyq4qpAw4IARUAAIhCGAFwAcABBg==&rs=AOn4CLA7SJIX7Y0LFpd5Ya6QC2EwRGkMZw,Drew Talbert,I’m just shocked Brad was able to sell him in that $20 hooch Co-write w/ Andrea Kelley
"Slay It Don’t Spray It w/ Ariana Grande, Kelly Clarkson, Blake Shelton & John Legend | That’s My Jam",https://www.youtube.com/watch?v=wUDbxd54lnw,https://i.ytimg.com/vi/wUDbxd54lnw/hqdefault.jpg?sqp=-oaymwEcCPYBEIoBSFXyq4qpAw4IARUAAIhCGAFwAcABBg==&rs=AOn4CLBpYY2FUpt3yTYk8XvzRCueKf6YlQ,The Tonight Show Starring Jimmy Fallon,"Jimmy Fallon hosts the ultimate karaoke party! Ariana Grande, Blake Shelton, Kelly Clarkson and John Legend go lyric for lyric in the hilarious game of Slay It Don’t Spray It. ABOUT THAT’S..."
dhruv - double take (Official Video),https://www.youtube.com/watch?v=R8FHtIhWqNo,https://i.ytimg.com/vi/R8FHtIhWqNo/hqdefault.jpg?sqp=-oaymwEcCPYBEIoBSFXyq4qpAw4IARUAAIhCGAFwAcABBg==&rs=AOn4CLDZPyVwRPrgjVk5OkbFUBJ2ZaD0og,dhruv,Follow dhruv: Instagram: https://www.instagram.com/dhrvie/ Facebook: https://www.facebook.com/dhrvie/ Twitter: https://twitter.com/dhrvie Directed by: Aboveground Produced by: Samuel Taylor...
Is Meat Really that Bad?,https://www.youtube.com/watch?v=F1Hq8eVOMHs,,Kurzgesagt – In a Nutshell,"The first 1,000 people to use this link will get a 1 month free trial of Skillshare: https://skl.sh/kurzgesagtinanutshell11211 Sources & further reading: https://sites.google.com/view/sources-clim..."
Things Get Strange With The UnderTaker | Cold as Balls | Laugh Out Loud Network,https://www.youtube.com/watch?v=GQXVQmcGQUY,,LOL Network,"#PoweredByOldSpice Thought by many as one of the greatest #WWE wrestlers of all time; the #Undertaker gets into the ice-cold tub to chat with #KevinHart about his legacy of wrestling, plus..."
Halo Infinite | Campaign Launch Trailer,https://www.youtube.com/watch?v=PyMlV5_HRWk,,HALO,"When all hope is lost and humanity’s fate hangs in the balance, the Master Chief is ready to confront the most ruthless foe he’s ever faced. Step inside the armor of humanity’s greatest..."
People Pleasers at a Restaurant,https://www.youtube.com/watch?v=n4XojTb6pfs,,Drew Talbert,I apologize for existing - please throw me out Co-write w/ Andrea Kelley #peoplepleasing #bistrohuddy #serverlife #restaurantlife #bartenderlife #funnyshorts #comedyshorts #socialanxiety...
why can't you curse? #shorts,https://www.youtube.com/watch?v=qQsHZ87Q8uI,,Alex Griswold,
World’s Sharpest Knife!,https://www.youtube.com/watch?v=ySXPnjStay4,,Beast Reacts,Chris and I react to the greatest item hacks in the world! CHECK OUT THESE CHANNELS OR ELSE Experimental Fun https://www.youtube.com/watch?v=5ZchgU9KLOc Louis Weisz https://www.youtube.com/watc...
